{
  "schema": "https://prompt-atoms.com/schemas/rule-v1.json",
  "type": "model-compatibility",
  "id": "claude-opus-tool-use",
  "version": "1.0.0",
  "name": "Claude Opus + GPT-4o tool-use compatibility",
  "description": "tool-use-template/parallel-when-independent is known-good on claude-opus and gpt-4o families; warn on llama and mistral.",
  "predicate": {
    "subject_ref": "prompt-atoms://atoms/tool-use-template/parallel-when-independent",
    "condition": "in",
    "value": ["claude", "gpt"]
  },
  "effect": "require",
  "rationale": "Parallel tool-use semantics differ across vendor SDKs. Claude and GPT support parallel function calls in a single turn; Llama and Mistral implementations typically serialize. Using this template on the wrong family causes silent serialization and inflated latency."
}
